source_type,source_name,url,date_accessed,key_responsibilities_extracted,tools_mentioned,pain_points_mentioned
job_board_template,Indeed Job Description,https://www.indeed.com/hire/job-description/facilities-manager,2025-01-15,"Perform routine maintenance; schedule inspections and emergency repairs; maintain day-to-day operations; delegate maintenance orders; oversee minor construction",Purchasing software,Maintenance scheduling; work order tracking
job_board_template,Workable Template,https://resources.workable.com/facilities-manager-job-description,2025-01-15,"Plan and coordinate installations and refurbishments; manage upkeep to meet health and safety standards; inspect buildings for repairs or renovations",Building systems,Safety compliance; maintenance coordination
industry_resource,BuildStream Guide,https://www.buildstream.co/job-descriptions/facilities-manager-8d1fb,2025-01-15,"Conduct regular inspections and maintenance; monitor budgets; implement cost-efficient practices; ensure compliance with health safety environmental regulations",CMMS software,Budget monitoring; compliance management
industry_resource,eWorkOrders Guide,https://eworkorders.com/cmms-industry-articles-eworkorders/facilities-manager-job-description/,2025-01-15,"Maintenance planning; asset management; compliance; operational efficiency; oversee heavy machinery upkeep; preventive maintenance planning; manage multiple teams",CMMS,Preventive maintenance; asset tracking
government_resource,BLS Occupational Outlook,https://www.bls.gov/ooh/management/administrative-services-managers.htm,2025-01-15,"Monitor facilities for safety and maintenance; oversee maintenance and repair of machinery equipment; ensure facilities meet environmental health security standards",Various,Safety monitoring; equipment maintenance
industry_resource,MaintainX Guide,https://www.getmaintainx.com/blog/facilities-manager-job-description-and-work-requirements,2025-01-15,"Manage facility people processes; ensure workplace meets employee needs; oversee space and infrastructure; people and organization; maintenance and repair",Facility management software,Workplace environment; employee satisfaction
industry_resource,MaintenanceManagerHQ,https://maintenancemanagerhq.com/facilities-maintenance-manager-job-description/,2025-01-15,"Plan and execute building maintenance; manage vendor contracts; coordinate site safety programs; ensure efficiency of building systems; prepare operation reports and budgets",CMMS; HVAC; electrical systems,Budget preparation; vendor management
government_resource,North Metro Fire Job Posting,https://www.northmetrofire.org/DocumentCenter/View/938/Facilities-Maintenance-Manager-Job-Description-,2025-01-15,"Ensure facilities are maintained and safe; assist with preventative maintenance; document repair requests; maintain detailed records; schedule maintenance inspections",Various building systems,Record keeping; inspection scheduling
academic_resource,PCC Job Posting,https://www.pcc.edu/hr/employment/management-jobs/associatefacilitiesmaintenancemanager/,2025-01-15,"Manages day-to-day building maintenance; oversees mechanical electrical energy management fire/life safety; coordinates work orders for preventative maintenance and requests",CMMS; DDC; EMS,Work order coordination; building systems
industry_resource,eWorkOrders Positions Guide,https://eworkorders.com/facilities-management-positions/,2025-01-15,"Ensure company buildings operate safely efficiently; manage space; oversee building maintenance; ensure compliance with environmental health safety regulations; develop maintenance plans",CMMS,Space management; compliance
pain_point_article,OfficeSpace FM Pain Points,https://www.officespacesoftware.com/blog/3-of-the-biggest-fm-pain-points-and-how-to-streamline-accordingly/,2025-01-15,"Time-consuming manual data entry; juggle dozens of daily requests; manage large team; space utilization tracking",FM software; Request manager,Manual data entry; request management; space tracking
pain_point_article,GoBright Challenges,https://gobright.com/blogs-and-articles/top-4-challenges-for-facilities-managers/,2025-01-15,"Data no longer up to date; difficult to retrieve data; insufficient workforce; cannot make time outside day-to-day tasks; new technology implementation",Smart workplace solutions,Outdated data; insufficient time; technology adoption
pain_point_article,ManoByte Pain Points,https://www.manobyte.com/growth-strategy/the-6-biggest-pain-points-for-facility-managers,2025-01-15,"Operation and management costs; budget control; equipment breakdowns repairs replacements; preventative maintenance scheduling; facility condition monitoring",Building automation,Budget control; equipment maintenance
pain_point_article,eWorks Manager Challenges,https://www.eworksmanager.co.uk/facility-management-challenges-and-solutions/,2025-01-15,"Managing budget; dealing with emergencies urgent matters; prioritize tasks; reduce time-consuming jobs; equipment maintenance; unexpected expenses",FM software; Inventory management,Budget management; emergency response; time management
pain_point_article,ARC Facilities Challenges,https://www.arcfacilities.com/blog/15-key-facility-management-challenges-and-solutions,2025-01-15,"Limited access to maintenance logs equipment details; sifting through outdated paper records; difficulty accessing real-time data; emergency response without data access",Mobile platform; Cloud apps,Data access; emergency response; paper-based records
pain_point_article,Intalio ERP Pain Points,https://www.intalio.com/blogs/why-facilities-management-pain-points-have-led-us-to-odoo-erp/,2025-01-15,"Asset valuation challenges; petty cash management; expense management; too much done over phone and email; CRM not being used",ERP; CRM,Asset tracking; expense management; communication
pain_point_article,FlowPath Roadblocks,https://www.getflowpath.com/blog/facility-management-roadblocks-and-how-to-avoid-them,2025-01-15,"Constantly putting out fires; emergency maintenance drains resources; manual paper-based operations; no critical insights and trends available; growing pains",CMMS,Emergency work; manual operations; scaling issues
pain_point_article,FacilityExecutive Challenges,https://facilityexecutive.com/addressing-everyday-challenges-in-office-management,2025-01-15,"Managing excessive workloads; communication issues acting as linchpin; efficient space utilization; employees spend 20% of workweek looking for information",CAFM software,Workload; communication; information finding
pain_point_article,QuickFMS Challenges,https://www.quickfms.com/blog/overcome-facilities-management-challenges,2025-01-15,"Damage prevention and control; urgent calls; determining next course of action; prioritizing tasks at short notice",FM software,Emergency prioritization; damage control
pain_point_article,Parallel Technologies,https://ptnet.com/blog/building-automation-solutions-six-pain-points-facility-managers-struggle-with-and-how-to-solve-them,2025-01-15,"Physical operation challenges; utility costs; regulatory compliance; managing assets; analyzing different issues; problem solving; budget while improving infrastructure",Building automation,Operations; compliance; asset management
