source_type,source_name,url,responsibilities_extracted,tools_mentioned,pain_points_noted
government,BLS Occupational Outlook Handbook,https://www.bls.gov/ooh/computer-and-information-technology/computer-support-specialists.htm,"Provide technical assistance to computer users; Answer questions or resolve computer problems; May provide assistance in person or via telephone/remotely; Support computer networks; Install and configure hardware/software; Monitor and maintain systems","None specific","24/7 availability requirements; Wide variation in work environments"
job_description,Indeed IT Support Template,https://www.indeed.com/hire/job-description/it-support,"Point of contact for all IT questions at user level; Respond to user needs in timely manner; Ensure optimal running of systems; Install network/camera cabling; Install wired/wireless networks; Problem resolution","Knowledge base systems; Diagnostic tools","Overwhelming volume of incoming requests; Time-consuming phone calls that flood queues"
job_description,Betterteam IT Support Specialist,https://www.betterteam.com/it-support-specialist-job-description,"Consulting with IT managers; Providing IT assistance to staff; Training end-users on hardware/software; Resolving logged errors; Monitoring performance metrics; Updating computer software; Maintaining databases; Documenting processes","IT helpdesk software (Freshservice, SysAid)","Need to keep up with technical innovation; Fast-paced environment demands"
job_description,BuildStream IT Support Specialist,https://www.buildstream.co/job-descriptions/it-support-specialist,"Installing and configuring hardware/software/networks/printers; Monitoring and maintaining systems; Providing technical support in person or over phone; Setting up accounts for new users; Testing new technology; Ensuring security/upgrades; Troubleshooting system/network issues","Active Directory; Microsoft 365; Remote desktop protocols","Responding promptly to service issues; Managing access permissions across organization"
job_description,WowRemoteTeams IT Support,https://wowremoteteams.com/blog/it-support-specialist-job-description/,"Diagnosing/resolving/preventing hardware/software/network issues; Managing incident response; System imaging; Endpoint security; Ticket triage; Application support; Onboarding workflows; Knowledge base documentation","ServiceNow; Freshservice; JAMF; Active Directory; Microsoft 365; VPN","Ensuring systems remain operational and secure; Supporting business continuity"
job_description,100hires IT Support Specialist,https://100hires.com/it-support-specialist-job-description.html,"Troubleshoot/configure/deploy/support desktops/laptops/mobile devices; Provide in-person meeting support; Support IT projects; Resolve issues with limited direction","Business applications; IT assets","Time pressure to resolve problems quickly; Working with limited direction"
job_description,Keka IT Support Template,https://www.keka.com/it-support-specialist-job-description-template,"Hardware setup/troubleshooting/repair; Software installation/maintenance; Database maintenance; System security; Handle computer upgrades/migrations/terminations; VIP services for executives","Microsoft 365; Google Workspace","Full lifecycle management complexity; VIP user expectations"
pain_points,INRY Service Desk Challenges,https://www.inry.com/insights/5-challenges-your-it-service-desk-faces-everyday,"Phone calls flood queues; Time-consuming to resolve; Users wait in long queues; Instant troubleshooting demands increasing; 43% of help desks use email to track requests","Email tracking; Structured ticket intake systems","Phone calls especially time consuming; Up to 43% track requests via email causing manual sorting"
pain_points,Help Desk Migration Challenges,https://help-desk-migration.com/it-service-desk-challenges/,"Teams waste time answering FAQs and repetitive issues; Password resets/file restoration/device reboots done repeatedly; Shadow IT from outside software; Mismanagement causes build-up of unresolved incidents","Self-service portals; Knowledge bases","Repetitive issues like password resets demotivate staff; Extended outages affect productivity"
pain_points,Tential Service Desk Challenges,https://tential.com/insights/top-5-it-service-desk-challenges-and-how-to-overcome-them,"Communication gap between IT staff and end-users; Complex IT environments with legacy systems and cloud services; Ticket volume overwhelming","Comprehensive training; Monitoring tools","Misunderstandings and frustration on both sides; Complex environments hard to troubleshoot"
pain_points,TeamDynamix Service Desk,https://www.teamdynamix.com/blog/how-to-solve-3-common-it-service-desk-challenges/,"Long waits for help; Increased friction resolving problems; Long hold queues; Waste valuable work hours; Manual processing bogs down resources","ITSM platform; Self-service portal","End-user satisfaction falls with long waits; Manual mundane tasks reduce training value"
pain_points,GovTech Service Desk Challenges,https://www.govtech.com/workforce/3-common-it-service-desk-challenges.html,"Minor issues become huge bottlenecks; Manual processing bogs down resources; Hours spent answering phones/requests; Little time for larger issues","Self-service portal; Knowledge base","High-volume departments spend hours on phones leaving little time for larger issues"
knowledge_mgmt,ProProfs Knowledge Base,https://www.proprofskb.com/blog/workforce-spend-much-time-searching-information/,"Employees waste 1.8 hours every day searching for information; Nearly quarter of workweek spent searching; Information scattered across emails/folders/tools","Knowledge base software","McKinsey: 1.8 hours/day wasted searching; Like hiring 5 employees but one always searching"
knowledge_mgmt,Document360 IT Documentation,https://document360.com/blog/it-documentation/,"49% of employees spend 30min-2hrs daily finding information; IT employees spend 4.2 hours looking for information; 31% feel burnt out from searching","IT documentation tools","49% spend up to 2 hours daily searching; IT employees spend half their day (4.2 hrs) looking for info"
knowledge_mgmt,Windows Forum Documentation,https://windowsforum.com/threads/documentation-discipline-cut-it-helpdesk-time-with-a-shared-knowledge-base.391054/,"IT teams lose hours hunting tribal knowledge; More than half take 5-29 minutes to locate prior solution second time; Documentation exists but not searchable","Centralized Knowledge Base; Ticket-to-KB integration","Tribal knowledge lives in individuals' heads; Search friction from poor metadata; Lack of incentives to document"
knowledge_mgmt,Atlassian Knowledge Management,https://www.atlassian.com/itsm/knowledge-management/ITIL,"Agents spend less time on requests with strong knowledge practice; KB articles suggested directly from Jira issues; Self-service troubleshooting faster","Jira Service Management; Knowledge base","Difference between time searching and time resolving; Having answers at fingertips crucial during outages"
ticket_mgmt,Ivanti Ticket Handling,https://www.ivanti.com/blog/it-ticket-handling-best-practices,"Cost of resolving ticket proportional to escalation level; Self-service costs $2 vs higher tier costs; Critical incidents need immediate notification; Unnecessary escalations increase costs","Service desk solution; Alerts configuration","Ticket escalation increases total cost; After-hours support critical for preventing business outages"
ticket_mgmt,ManageEngine Ticket Management,https://www.manageengine.com/products/service-desk/help-desk-software/10-tips-for-efficient-ticket-management.html,"Knowledge base benefits IT end users and technicians; Technicians can convert solutions to knowledge items; Self-service portal cuts expenses and time; End users prefer self-sufficiency","IT help desk application; Knowledge base; Self-service portal","Repetitive issues waste time; Answering same questions repeatedly frustrates everyone"
ticket_mgmt,Newegg Documentation Tips,https://www.neweggbusiness.com/smartbuyer/collaboration/ticket-documentation-improvements-that-pay-off/,"Unnecessary documentation takes extra time and makes tickets long/confusing; Good ticketing software essential; Automated tools for account unlocks/resets valuable","Remedy; ServiceNow; Internal knowledgebase","Documenting everything is impractical; Long tickets not useful for reference"
statistics,MetricNet Tickets per Tech,https://www.thinkhdi.com/~/media/HDICorp/Files/Library-Archive/Insider%20Articles/tickets-per-technician.pdf,"Average tickets per technician ranges 30-198 per month; Desktop technician headcount 5.4-28.4 per 1000 seats by industry; Ticket volume drives headcount needs","Desktop support metrics","Wide variation in workload; Service requests take more time than incidents"
statistics,JitBit Support Metrics,https://www.jitbit.com/news/2266-average-customer-support-metrics-from-1000-companies/,"Average 21 support tickets per technician per day; At 30 tickets/day should hire another agent; Average response time 7 hours; Top 20% respond in 2 hours","Ticketing system","Workload threshold around 30 tickets/day per tech"
statistics,Desku Help Desk Statistics,https://desku.io/stats-hub/help-desk-statistics/,"Ticket volume risen 16% since pandemic; 60% customers expect response within 1 hour; 81% attempt self-solve before contacting agent; AI can handle 80% routine inquiries; $1.60/minute to handle ticket","Help desk software; AI chatbots","Growing demand post-pandemic; High expectations for response time"
statistics,Fullview Support Statistics,https://www.fullview.io/blog/support-stats,"91% of leaders say customer expectations grown; 78% organizations use AI in at least one function; AI reduces costs 25-30%; Unity saved $1.3M deflecting 8000 tickets","AI customer service; Support solutions","Rising expectations; Need for AI to handle volume"
password_resets,Atomicwork Password Reset,https://www.atomicwork.com/blog/self-service-password-reset,"Password resets most common helpdesk questions; At least $42,500/year productivity loss for 1000 employees; Hidden cost of manual resets","Self-service password reset; Slack/Teams integration","Password resets consume significant time; Hidden productivity costs"
password_resets,Specops Password Best Practices,https://specopssoft.com/blog/helpdesk-password-reset-best-practices/,"Significant percentage of helpdesk calls password-related; Each password reset costs average $70; Self-service reduces IT support routine calls","Self-service password reset; Identity verification","Forrester: Password issues significant % of calls; $70 average cost per reset"
tier_structure,ITBD Support Tiers,https://itbd.net/blog/helpdesk/it-support-tiers-tier1-vs-tier2-vs-tier3/,"Password resets make up 30% of all tickets; Organizations with defined tiers achieve 72% first-call resolution vs 45% without; Mean time to resolution drops 33% with structured tiers","Remote desktop support; Ticketing systems","Password resets ~30% of tickets; Well-defined tiers crucial for efficiency"
common_issues,ITAdOn 50 Common Problems,https://itadon.com/blog/50-most-common-it-support-problems-and-their-solutions/,"Password recovery issues; Account lockouts; VPN connection problems; Multi-monitor configuration; External drive recognition; Software compatibility","System logs; Event viewers; Diagnostic tools","Wide range of issues from simple to complex"
common_issues,DeskAlerts Helpdesk Problems,https://www.alert-software.com/blog/the-most-common-helpdesk-problems-and-how-to-solve-them,"Password issues most common; Software installation failures from incompatible versions or insufficient permissions; Account lockouts from failed login attempts","Self-service password reset portal; Password management software","Password issues dominate; Software installation failures from compatibility"
common_issues,XL.net Common Issues,https://xl.net/front-page/common-help-desk-issues/,"57% of employees reset work password in past 90 days; Blue screen of death; Slow internet; Lost wireless signal; Deleted files recovery; Login troubles","Authentication portals; Remote access software","Password trouble extremely common; Network issues frequent"
onboarding,GetPrimo IT Onboarding,https://www.getprimo.com/blog/onboarding-process-manage-new-employees,"Average onboarding involves 50 administrative steps; IT setup can account for 20+ steps; More than 10 IT vendors per employee; Time-consuming process","Device management; Software setup","IT onboarding time-consuming; 50+ admin steps; Becomes bottleneck if inefficient"
onboarding,Adaface IT Onboarding,https://www.adaface.com/blog/it-onboarding/,"Software installation can take entire day; Hardware setup before first day critical; Data security major concern; Need IT support contact info for new hires","Company email; Internal messaging; HR software; Productivity tools","Software installation very time-consuming; Full day for updates"
onboarding,Deel IT Onboarding,https://www.deel.com/blog/it-onboarding-process/,"Delays cost productivity and slow ramp time; Turnover rates as high as 50% in first 18 months without proper onboarding; Start moment new teammate hired","Account setup automation; Slack messages","Delays = lost productivity; Poor onboarding leads to turnover"
onboarding,ManageEngine Onboarding,https://www.manageengine.com/products/service-desk/itsm/employee-onboarding-and-offboarding.html,"48% businesses aware former employees still have access; 24% report onboarding extends over a month; Manual provisioning labor-intensive and prone to delays; Single human error can lead to security mishaps","ESM portal; HRMS integration","Manual effort = wide margin of error; Security risks from oversight"
tools,ITSM Comparison 2025,https://kanini.com/blog/itsm-software-comparison-2025-servicenow-vs-jira-vs-freshservice-vs-zendesk-vs-ivanti-vs-solarwinds/,"ServiceNow recognized as Leader in AI for ITSM by Gartner 2024; AI capabilities enable optimization of support processes; Tangible cost reduction through automation","ServiceNow; Jira; Freshservice; Zendesk; Ivanti; SolarWinds","Choosing right ITSM platform critical for scaling operations"
tools,Zapier Jira vs ServiceNow,https://zapier.com/blog/jira-vs-servicenow/,"Jira suited for small-medium business or basic ticketing; ServiceNow is enterprise gold standard; Both handle ticket assignment/role management/workflows","Jira Service Management; ServiceNow; Atlassian Intelligence","ServiceNow heavy organizational lift; Jira more nimble for moderate ITSM needs"
certifications,CompTIA Support Certifications,https://www.comptia.org/en-us/blog/best-it-support-and-help-desk-certifications/,"CompTIA A+ foundational vendor-neutral certification; 79% HR professionals look for certifications; ITIL Foundation helps manage risk and strengthen customer relations","CompTIA A+; Network+; Security+; ITIL Foundation","Certifications prove skills to employers; ITIL critical for service management"
day_in_life,CompTIA Tier 1 Day in Life,https://www.comptia.org/en-us/blog/a-day-in-the-life-of-an-it-pro-tier-1-help-desk-specialist/,"Typical day begins logging in and setting up programs; At least 10 applications open; Assigned to calls or chats; Work includes password resets/how-tos/break-fix/escalations; Access documentation/knowledge base","Multiple applications; Knowledge base; Chat systems","Challenging to apply training in real scenarios; Overwhelming to handle multiple applications"
day_in_life,CCI Training Day in Life,https://ccitraining.edu/blog/day-in-the-life-of-a-computer-support-technician-what-to-expect/,"First point of contact for technical difficulties; Primary goal ensure smooth operation; Wide range of tasks from simple to complex; Check open tickets; Run system diagnostics; Lunch breaks often not complete breaks","Help desk software (Freshdesk, Zendesk, Jira SM)","Fast-growing but demanding career; Lunch breaks interrupted for small businesses"
